{
  "$schema": "http://json-schema.org/draft-07/schema#",
  "$ref": "#/definitions/TalentLvlUpMaterial",
  "definitions": {
    "TalentLvlUpMaterial": {
      "type": "object",
      "properties": {
        "id": {
          "type": "string"
        },
        "name": {
          "type": "string"
        },
        "description": {
          "type": "string"
        },
        "source": {
          "type": "array",
          "items": {
            "type": "string"
          }
        },
        "location": {
          "type": "string"
        },
        "rarity": {
          "type": "number"
        },
        "convert": {
          "anyOf": [
            {
              "type": "array",
              "items": {
                "type": "array",
                "items": {
                  "type": "object",
                  "properties": {
                    "id": {
                      "type": "string"
                    },
                    "name": {
                      "type": "string"
                    },
                    "amount": {
                      "type": "number"
                    }
                  },
                  "required": [
                    "id",
                    "name",
                    "amount"
                  ],
                  "additionalProperties": false
                }
              }
            },
            {
              "type": "array",
              "items": {
                "type": "object",
                "properties": {
                  "id": {
                    "type": "string"
                  },
                  "name": {
                    "type": "string"
                  },
                  "amount": {
                    "type": "number"
                  }
                },
                "required": [
                  "id",
                  "name",
                  "amount"
                ],
                "additionalProperties": false
              }
            }
          ]
        },
        "craft": {
          "type": "object",
          "properties": {
            "cost": {
              "type": "number"
            },
            "items": {
              "type": "array",
              "items": {
                "type": "object",
                "properties": {
                  "id": {
                    "type": "string"
                  },
                  "name": {
                    "type": "string"
                  },
                  "amount": {
                    "type": "number"
                  }
                },
                "required": [
                  "id",
                  "name",
                  "amount"
                ],
                "additionalProperties": false
              }
            }
          },
          "required": [
            "cost",
            "items"
          ],
          "additionalProperties": false
        },
        "domain": {
          "type": "string"
        },
        "days": {
          "type": "array",
          "items": {
            "type": "string"
          }
        },
        "version": {
          "type": "string"
        }
      },
      "required": [
        "id",
        "name",
        "description",
        "source",
        "rarity",
        "version"
      ],
      "additionalProperties": false
    }
  }
}