{
  "id": "GildedScale",
  "name": "Gilded Scale",
  "description": "Setelah melewati waktu yang tak terhitung jumlahnya dan terurai ke dalam bumi, emas dan batu obsidian menyatu ke dalam darah dan daging mineral, dan dari situlah sisik-sisik zirah terbentuk.<br/>Rasa sakit yang membara, tangisan penuh derita yang tak bersuara... mungkin semua kesengsaraan itu akan menghilang di saat dendam kesumat yang memunculkan mereka, juga mencapai titik akhir.",
  "source": [
    "Hadiah tantangan Azhdaha Lv. 70+"
  ],
  "rarity": 5,
  "convert": [
    [
      {
        "id": "DragonLordsCrown",
        "name": "Dragon Lord's Crown",
        "amount": 1
      },
      {
        "id": "DreamSolvent",
        "name": "Dream Solvent",
        "amount": 1
      }
    ],
    [
      {
        "id": "BloodjadeBranch",
        "name": "Bloodjade Branch",
        "amount": 1
      },
      {
        "id": "DreamSolvent",
        "name": "Dream Solvent",
        "amount": 1
      }
    ]
  ],
  "version": "5.0"
}