{
  "id": "VarunadaLazuriteGemstone",
  "name": "Varunada Lazurite Gemstone",
  "description": "\"Ideologiku tidak bernoda.\"\"Aku harus membenarkanmu. Orang-orang di sini tidak berdosa di mata para Dewa... hanya hukum dan Tribunal yang bisa menghakimi seseorang.\"\"Mereka bahkan dapat menghakimiku. Jadi pujalah keindahan dan kemurnianku.\"",
  "source": [
    "Didapatkan melalui Craft",
    "Buka Tab Investigasi di Buku Panduan Petualang"
  ],
  "rarity": 5,
  "craft": {
    "cost": 2700,
    "items": [
      {
        "id": "VarunadaLazuriteChunk",
        "name": "Varunada Lazurite Chunk",
        "amount": 3
      }
    ]
  },
  "convert": [
    [
      {
        "id": "AgnidusAgateGemstone",
        "name": "Agnidus Agate Gemstone",
        "amount": 1
      },
      {
        "id": "DustOfAzoth",
        "name": "Dust of Azoth",
        "amount": 27
      }
    ],
    [
      {
        "id": "NagadusEmeraldGemstone",
        "name": "Nagadus Emerald Gemstone",
        "amount": 1
      },
      {
        "id": "DustOfAzoth",
        "name": "Dust of Azoth",
        "amount": 27
      }
    ],
    [
      {
        "id": "VajradaAmethystGemstone",
        "name": "Vajrada Amethyst Gemstone",
        "amount": 1
      },
      {
        "id": "DustOfAzoth",
        "name": "Dust of Azoth",
        "amount": 27
      }
    ],
    [
      {
        "id": "VayudaTurquoiseGemstone",
        "name": "Vayuda Turquoise Gemstone",
        "amount": 1
      },
      {
        "id": "DustOfAzoth",
        "name": "Dust of Azoth",
        "amount": 27
      }
    ],
    [
      {
        "id": "ShivadaJadeGemstone",
        "name": "Shivada Jade Gemstone",
        "amount": 1
      },
      {
        "id": "DustOfAzoth",
        "name": "Dust of Azoth",
        "amount": 27
      }
    ],
    [
      {
        "id": "PrithivaTopazGemstone",
        "name": "Prithiva Topaz Gemstone",
        "amount": 1
      },
      {
        "id": "DustOfAzoth",
        "name": "Dust of Azoth",
        "amount": 27
      }
    ]
  ],
  "version": "1.6"
}