{
  "id": "HellfireButterfly",
  "name": "Borboleta das Chamas Infernais",
  "description": "O selo de gelo foi quebrado sob a pressão, e a medida que a sua determinação antiga saiu de sua prisão branca pálida e ela lembrou seu antigo nome mais uma vez, e a borboleta imortal dançou entre a carne e sangue flamejantes. E então ela lembrou seu passado, vagando pela terra, queimando todo o mal, assim como o rosto da pessoa que ela não poderia ver novamente.",
  "source": [
    "Recompensa do Desafio de Signora Nv.70+",
    "Recompensa do Desafio de Signora Nv.70+"
  ],
  "rarity": 5,
  "convert": [
    [
      {
        "id": "MoltenMoment",
        "name": "Momento Derretido",
        "amount": 1
      },
      {
        "id": "DreamSolvent",
        "name": "Solvente dos Sonhos",
        "amount": 1
      }
    ],
    [
      {
        "id": "AshenHeart",
        "name": "Coração das Cinzas",
        "amount": 1
      },
      {
        "id": "DreamSolvent",
        "name": "Solvente dos Sonhos",
        "amount": 1
      }
    ],
    [
      {
        "id": "MoltenMoment",
        "name": "Momento Derretido",
        "amount": 1
      },
      {
        "id": "DreamSolvent",
        "name": "Solvente dos Sonhos",
        "amount": 1
      }
    ],
    [
      {
        "id": "AshenHeart",
        "name": "Coração das Cinzas",
        "amount": 1
      },
      {
        "id": "DreamSolvent",
        "name": "Solvente dos Sonhos",
        "amount": 1
      }
    ]
  ],
  "version": "5.0"
}