{
  "id": "LightlessMass",
  "name": "Тёмная масса",
  "description": "Вселенная - темное и холодное место. Но приглядитесь хорошенько. Внутри всегда есть слабые отблески света, как жемчужины, сверкающие в песке, как осколки алмаза, рассыпанные по асфальту, как огни, пробивающиеся сквозь туманную ночь, как искры, зажигающие самые яркие огни.",
  "source": [
    "Всепожирающий нарвал Ур. 70+",
    "Всепожирающий нарвал Ур. 70+"
  ],
  "rarity": 5,
  "convert": [
    [
      {
        "id": "LightlessSilkString",
        "name": "Тёмная шёлковая нить",
        "amount": 1
      },
      {
        "id": "DreamSolvent",
        "name": "Растворитель снов",
        "amount": 1
      }
    ],
    [
      {
        "id": "LightlessEyeOfTheMaelstrom",
        "name": "Тёмный глаз вихря",
        "amount": 1
      },
      {
        "id": "DreamSolvent",
        "name": "Растворитель снов",
        "amount": 1
      }
    ],
    [
      {
        "id": "LightlessSilkString",
        "name": "Тёмная шёлковая нить",
        "amount": 1
      },
      {
        "id": "DreamSolvent",
        "name": "Растворитель снов",
        "amount": 1
      }
    ],
    [
      {
        "id": "LightlessEyeOfTheMaelstrom",
        "name": "Тёмный глаз вихря",
        "amount": 1
      },
      {
        "id": "DreamSolvent",
        "name": "Растворитель снов",
        "amount": 1
      }
    ]
  ],
  "version": "5.0"
}