{
  "id": "AshenHeart",
  "name": "Cœur de cendre",
  "description": "Les larmes ne peuvent éteindre les flammes. Tristesse et rage, aussi brûlantes que la fonte, coulent dans ses veines et s'évacuent par ses glandes lacrymales.<br/>Le premier Fatui l'a découverte avant que son cœur ne soit détruit par les flammes éternelles. Il fit d'elle une alliée, car il avait compris que seules une haine et une obstination plus féroces pouvaient éteindre le feu qui la dévorait.",
  "source": [
    "Défi de Signora (Niv.70+)"
  ],
  "rarity": 5,
  "convert": [
    [
      {
        "id": "MoltenMoment",
        "name": "Moment en fusion",
        "amount": 1
      },
      {
        "id": "DreamSolvent",
        "name": "Solvant de rêve",
        "amount": 1
      }
    ],
    [
      {
        "id": "HellfireButterfly",
        "name": "Papillon infernal",
        "amount": 1
      },
      {
        "id": "DreamSolvent",
        "name": "Solvant de rêve",
        "amount": 1
      }
    ]
  ],
  "version": "5.0"
}