{
  "id": "PrithivaTopazGemstone",
  "name": "Prithiva Topaz Gemstone",
  "description": "เงินทั้งหมดที่หมุนเวียนอยู่ในแผ่นดินใหญ่คือเนื้อและเลือดของฉัน<br/>\"ด้วยวิธีนี้ฉันเป็นผู้รับประกันหยาดเหงื่อ ปัญญา และอนาคตของมนุษยชาติทั้งหมด\"<br/>\"นี่คือความเชื่อของฉันที่มีต่อสิ่งมีชีวิต การทรยศต่อมันจะทำให้เลือดของฉันต้องแปดเปื้อน\"",
  "source": [
    "ได้รับจากการสรรสร้าง",
    "ดูที่แท็บปราบปรามในคู่มือนักผจญภัย"
  ],
  "rarity": 5,
  "craft": {
    "cost": 2700,
    "items": [
      {
        "id": "PrithivaTopazChunk",
        "name": "Prithiva Topaz Chunk",
        "amount": 3
      }
    ]
  },
  "convert": [
    [
      {
        "id": "AgnidusAgateGemstone",
        "name": "Agnidus Agate Gemstone",
        "amount": 1
      },
      {
        "id": "DustOfAzoth",
        "name": "Dust of Azoth",
        "amount": 27
      }
    ],
    [
      {
        "id": "VarunadaLazuriteGemstone",
        "name": "Varunada Lazurite Gemstone",
        "amount": 1
      },
      {
        "id": "DustOfAzoth",
        "name": "Dust of Azoth",
        "amount": 27
      }
    ],
    [
      {
        "id": "NagadusEmeraldGemstone",
        "name": "Nagadus Emerald Gemstone",
        "amount": 1
      },
      {
        "id": "DustOfAzoth",
        "name": "Dust of Azoth",
        "amount": 27
      }
    ],
    [
      {
        "id": "VajradaAmethystGemstone",
        "name": "Vajrada Amethyst Gemstone",
        "amount": 1
      },
      {
        "id": "DustOfAzoth",
        "name": "Dust of Azoth",
        "amount": 27
      }
    ],
    [
      {
        "id": "VayudaTurquoiseGemstone",
        "name": "Vayuda Turquoise Gemstone",
        "amount": 1
      },
      {
        "id": "DustOfAzoth",
        "name": "Dust of Azoth",
        "amount": 27
      }
    ],
    [
      {
        "id": "ShivadaJadeGemstone",
        "name": "Shivada Jade Gemstone",
        "amount": 1
      },
      {
        "id": "DustOfAzoth",
        "name": "Dust of Azoth",
        "amount": 27
      }
    ]
  ],
  "version": "5.0"
}